{
  "schema_version": "event_schema_v1",
  "event_id": "44444444-4444-4444-8444-444444444444",
  "timestamp": "2026-04-03T20:10:06Z",
  "protocol": "ssh",
  "source_ip": "192.168.56.10",
  "source_port": 49822,
  "destination_port": 22,
  "session_id": "aaaaaaaa-aaaa-4aaa-8aaa-aaaaaaaaaaaa",
  "event_sequence": 4,
  "event_type": "ssh.connection_closed",
  "payload": {
    "reason": "client_disconnected",
    "had_authenticated_session": false
  },
  "metadata": {
    "sensor_id": "sensor-ssh-01",
    "sensor_type": "honeypot-rust",
    "transport": "amqp",
    "ingest_source": "ssh-connection-handler",
    "capture_mode": "live"
  }
}