{
  "schema_version": "event_schema_v1",
  "event_id": "33333333-3333-4333-8333-333333333333",
  "timestamp": "2026-04-03T20:10:04Z",
  "protocol": "ssh",
  "source_ip": "192.168.56.10",
  "source_port": 49822,
  "destination_port": 22,
  "session_id": "aaaaaaaa-aaaa-4aaa-8aaa-aaaaaaaaaaaa",
  "event_sequence": 3,
  "event_type": "ssh.auth_result",
  "payload": {
    "success": false,
    "reason": "invalid_credentials"
  },
  "metadata": {
    "sensor_id": "sensor-ssh-01",
    "sensor_type": "honeypot-rust",
    "transport": "amqp",
    "ingest_source": "ssh-auth-handler",
    "capture_mode": "live"
  }
}